{
  "skill_name": "cloudy-tech-diagrams",
  "version": 1,
  "objective_profiles": {
    "technical-diagram-default": {
      "assertion_categories": [
        "artifact-structure",
        "export-controls",
        "semantic-annotations",
        "connector-semantics",
        "source-coverage",
        "unexecuted-check-reporting"
      ],
      "expectations": [
        "The output is one browser-ready .html artifact with one primary inline SVG sheet.",
        "The artifact preserves Copy Image, Download PNG, Download PDF, and Download Draw.io controls.",
        "Meaningful diagram content uses Draw.io semantic annotations or an explicit ignore reason.",
        "Every visible connector has a source, target, and relationship meaning.",
        "The response reports which rendered or export checks were not run when the environment cannot execute them."
      ],
      "human_review_categories": [
        "layout-quality",
        "information-selection",
        "visual-clarity"
      ]
    },
    "technical-diagram-optional-artifact": {
      "assertion_categories": [
        "artifact-structure",
        "export-controls",
        "semantic-annotations",
        "connector-semantics",
        "source-coverage",
        "unexecuted-check-reporting"
      ],
      "expectations": [
        "A clarification-only response may pass without creating diagram.html when it exposes unresolved assumptions and asks for the minimum missing information.",
        "If diagram.html is created, it is one browser-ready .html artifact with one primary inline SVG sheet.",
        "If diagram.html is created, it preserves Copy Image, Download PNG, Download PDF, and Download Draw.io controls.",
        "If diagram.html is created, meaningful diagram content uses Draw.io semantic annotations or an explicit ignore reason.",
        "If diagram.html is created, every visible connector has a source, target, and relationship meaning or is marked unresolved.",
        "The response reports which applicable rendered or export checks were not run when the environment cannot execute them."
      ],
      "human_review_categories": [
        "layout-quality",
        "information-selection",
        "visual-clarity"
      ]
    },
    "routing-near-miss": {
      "assertion_categories": ["non-trigger-routing"],
      "expectations": [
        "The response does not create a Cloudy Tech Diagrams technical architecture artifact.",
        "The response routes the request to the more appropriate adjacent workflow."
      ],
      "human_review_categories": ["routing-quality"]
    }
  },
  "prompt_manifest": {
    "version": 1,
    "sha256": {
      "simple-architecture": "0ffa91a2ea4905e08aaa6b7fef27ec59e6325cf560744434202715027778739e",
      "event-heavy-flow": "f404aa450d30a5aece73858ac7bbf9a3163ee468caa8620c95d6a110f52217f4",
      "dense-cross-boundary-deployment": "64e489a3d2d76c9ec067af31179975b56c33b349707b60e5738b734d6a6f18a9",
      "runtime-mechanism": "fb401ecc5baa52d32d308c4a74a36ebbf6066a321e7d44014131086952fc3042",
      "source-driven-authoring": "d8db7e1b853bf1f8a9f4ac4b605c49c1744514757c01b0faa7e16a81ae2ab7de",
      "incomplete-input": "c55c668cae1a20bf982f7e5b804a9b3efdef0a7e088bffc1cee0d36e73fa3e69",
      "mixed-chinese-english-labels": "e6215289c1115668edb8dca5565e0be9ede58ba3894de4cf7b30f8a1af17268c",
      "near-miss-dashboard": "f1bd048c566124af7d0d9ea4455689070ab362c6c61e982a69ed5e83aeca4bc6",
      "near-miss-landing-page": "635b3feaada54f5df1a432854ef992c3a320f28b80e84ce43eed054e210e6044",
      "near-miss-generic-deck": "1131738fd63be2c98486bdb2b04a8739aa520259d02c100ca5fdd72af58f0f08",
      "near-miss-non-technical-illustration": "067d383cf994929e0063edb963d585a961c3a8b000370ed0e6f906a99de02b91"
    }
  },
  "evals": [
    {
      "id": 1,
      "name": "simple-architecture",
      "scope": "technical-diagram",
      "should_invoke_skill": true,
      "diagram_family": "Architecture View",
      "prompt": "Create a Cloudy Tech Diagram for a small web application. Show a browser client calling an API service, the API reading from a PostgreSQL database, and the API storing uploaded files in an object-storage bucket. Use one left-to-right reading path, label each relationship, save one browser-ready HTML artifact as diagram.html, and preserve the built-in export actions.",
      "expected_output": "One standalone diagram.html that explains the four components and their relationships as a coherent architecture view.",
      "files": [],
      "objective_profile": "technical-diagram-default",
      "expectations": [
        "The browser diagram accounts for the browser, API, PostgreSQL, and object-storage components plus browser-to-API, API-to-database, and API-to-bucket relationships."
      ],
      "human_review": [
        "Visual clarity: Is the architecture question and left-to-right reading path immediately clear?",
        "Layout quality: Are component choices, spacing, typography, and visual hierarchy coherent?",
        "Information selection: Does the diagram communicate enough detail without unnecessary decoration?"
      ]
    },
    {
      "id": 2,
      "name": "event-heavy-flow",
      "scope": "technical-diagram",
      "should_invoke_skill": true,
      "diagram_family": "Process Flow",
      "prompt": "Create diagram.html for an event-heavy order workflow. A checkout API publishes OrderPlaced to a message bus; inventory and payment consumers process it independently; payment retries transient failures; a coordinator emits OrderConfirmed or OrderRejected; notifications subscribe to the final event. Show the event pills on the flow centerlines, distinguish request, event, retry, and final outcome relationships, and keep the HTML-first Draw.io export contract.",
      "expected_output": "One self-contained HTML process diagram showing the event bus, independent consumers, retry branch, and final outcomes with readable connector semantics.",
      "files": [],
      "objective_profile": "technical-diagram-default",
      "expectations": [
        "The diagram accounts for OrderPlaced, inventory, payment, transient retry, OrderConfirmed, OrderRejected, notifications, and their requested relationships."
      ],
      "human_review": [
        "Visual clarity: Are event order, independent consumers, and retry behavior readable without tracing tangled lines?",
        "Layout quality: Are event pills and connector labels placed without overlap or ambiguity?",
        "Information selection: Does the composition prioritize the workflow rather than decorative infrastructure?"
      ]
    },
    {
      "id": 3,
      "name": "dense-cross-boundary-deployment",
      "scope": "technical-diagram",
      "should_invoke_skill": true,
      "diagram_family": "Cloud or Deployment View",
      "prompt": "Create diagram.html for a dense deployment view of a multi-region service. Show users entering a CDN and WAF, public and private subnets, an API gateway, services in two availability zones, a managed database, a cache, and a cross-region replication path. Make trust, network, and service boundaries explicit; make every boundary crossing visible; keep long cross-boundary routes curved and readable; preserve editable Draw.io export.",
      "expected_output": "One standalone deployment diagram with explicit region, network, trust, and service containment plus readable cross-boundary connections.",
      "files": [],
      "objective_profile": "technical-diagram-default",
      "expectations": [
        "The diagram accounts for the CDN, WAF, public and private subnets, gateway, both availability zones, database, cache, replication path, and every requested boundary crossing."
      ],
      "human_review": [
        "Visual clarity: Can a reader distinguish containment from connection in the dense layout?",
        "Layout quality: Are boundaries padded, crossings visible, and long routes legible?",
        "Information selection: Does the diagram remain scannable at the target viewport?"
      ]
    },
    {
      "id": 4,
      "name": "runtime-mechanism",
      "scope": "technical-diagram",
      "should_invoke_skill": true,
      "diagram_family": "Runtime Mechanism Mode",
      "prompt": "Create diagram.html explaining how a profiling request becomes an observable report at runtime. Show the trigger, coordinator, worker group, shared state or store, carrier between processes, transformations, runtime boundary, and observable output. Use Runtime Mechanism Mode, make the causal path explicit, preserve meaningful table-like state and stacked worker primitives as editable Draw.io cells, and keep the browser-first export behavior.",
      "expected_output": "One runtime mechanism diagram that answers what causes what from profiling trigger to report, with deliberate causal roles and editable primitives.",
      "files": [],
      "objective_profile": "technical-diagram-default",
      "expectations": [
        "The diagram represents or intentionally omits with a reason the applicable trigger, participant, boundary, carrier, transformation, state/store, and observable-output roles."
      ],
      "human_review": [
        "Information selection: Does the diagram explain causality rather than merely list architecture components?",
        "Layout quality: Are runtime roles, state, worker layers, and boundary crossings visually distinct?",
        "Visual clarity: Is the trigger-to-output path easy to follow?"
      ]
    },
    {
      "id": 5,
      "name": "source-driven-authoring",
      "scope": "technical-diagram",
      "should_invoke_skill": true,
      "diagram_family": "Architecture View",